<?xml version="1.0" encoding="UTF-8"?>
<!-- Enunciado dado una relación de asistentes formada por alumnos y profesores, y cada uno de ellos tiene nombre.
Hay varios alumnos y varios profesores. Definir un nombre de espacio para cada uno de ellos
alumnos_profesores.xml.
Asociarle una definición DTD-->
<asistentes xmlns:xsi="http://www.w3.org/2001/XMLSchema-instance" xsi:noNamespaceSchemaLocation="alumnos_profesores.xsd" xmlns:P="profesores" xmlns:A="alumnos">
    <profesores>
        <profesor>
            <nombre>Profesor 1</nombre>
        </profesor>
        <profesor>
            <nombre>Profesor 2</nombre>
        </profesor>
    </profesores>
    <alumnos>
        <alumno>
            <nombre>Alumno 1</nombre>
        </alumno>
        <alumno>
            <nombre>Alumno 2</nombre>
        </alumno>
    </alumnos>
</asistentes>